{
  "qualificationYear": 2020,
  "averagePercentValue": 100,
  "yr1QualificationDataYear": 2018,
  "yr1QualificationDataTypeCode": "A",
  "yr1PercentageValue": 100,
  "yr2QualificationDataYear": 2019,
  "yr2QualificationDataTypeCode": "A",
  "yr2PercentageValue": 100,
  "yr3QualificationDataYear": 2020,
  "yr3QualificationDataTypeCode": "A",
  "yr3PercentageValue": 100,
  "id": "02227-BSGR-56EB0D4D400642A4860D6402698BBE16",
  "qualificationId": "02022-614W-608B84AEDB8148C7B3935EE935AB835F",
  "userId": "abcde",
  "addDate": "2021-04-01",
  "updateDate": "2021-04-01"
}